{
  "$schema": "../../schema/latest.schema.json",
  "version": 1,
  "generatedAt": "2026-09-24T15:20:57.619Z",
  "today": {
    "$schema": "../../../schema/prices.schema.json",
    "version": 1,
    "date": "2026-09-24",
    "timezone": "Europe/Amsterdam",
    "currency": "EUR",
    "vat": "excluded",
    "fetchedAt": "2026-09-24T15:20:57.614Z",
    "electricity": {
      "unit": "EUR/kWh",
      "source": "energyzero",
      "hourly": [
        {
          "start": "2026-09-24T00:00:00+02:00",
          "startUtc": "2026-09-23T22:00:00Z",
          "price": 0.155292
        },
        {
          "start": "2026-09-24T01:00:00+02:00",
          "startUtc": "2026-09-23T23:00:00Z",
          "price": 0.152602
        },
        {
          "start": "2026-09-24T02:00:00+02:00",
          "startUtc": "2026-09-24T00:00:00Z",
          "price": 0.13039
        },
        {
          "start": "2026-09-24T03:00:00+02:00",
          "startUtc": "2026-09-24T01:00:00Z",
          "price": 0.153123
        },
        {
          "start": "2026-09-24T04:00:00+02:00",
          "startUtc": "2026-09-24T02:00:00Z",
          "price": 0.153952
        },
        {
          "start": "2026-09-24T05:00:00+02:00",
          "startUtc": "2026-09-24T03:00:00Z",
          "price": 0.158365
        },
        {
          "start": "2026-09-24T06:00:00+02:00",
          "startUtc": "2026-09-24T04:00:00Z",
          "price": 0.17356
        },
        {
          "start": "2026-09-24T07:00:00+02:00",
          "startUtc": "2026-09-24T05:00:00Z",
          "price": 0.218002
        },
        {
          "start": "2026-09-24T08:00:00+02:00",
          "startUtc": "2026-09-24T06:00:00Z",
          "price": 0.206477
        },
        {
          "start": "2026-09-24T09:00:00+02:00",
          "startUtc": "2026-09-24T07:00:00Z",
          "price": 0.161105
        },
        {
          "start": "2026-09-24T10:00:00+02:00",
          "startUtc": "2026-09-24T08:00:00Z",
          "price": 0.115062
        },
        {
          "start": "2026-09-24T11:00:00+02:00",
          "startUtc": "2026-09-24T09:00:00Z",
          "price": 0.085245
        },
        {
          "start": "2026-09-24T12:00:00+02:00",
          "startUtc": "2026-09-24T10:00:00Z",
          "price": 0.052763
        },
        {
          "start": "2026-09-24T13:00:00+02:00",
          "startUtc": "2026-09-24T11:00:00Z",
          "price": 0.03941
        },
        {
          "start": "2026-09-24T14:00:00+02:00",
          "startUtc": "2026-09-24T12:00:00Z",
          "price": 0.03903
        },
        {
          "start": "2026-09-24T15:00:00+02:00",
          "startUtc": "2026-09-24T13:00:00Z",
          "price": 0.079988
        },
        {
          "start": "2026-09-24T16:00:00+02:00",
          "startUtc": "2026-09-24T14:00:00Z",
          "price": 0.12056
        },
        {
          "start": "2026-09-24T17:00:00+02:00",
          "startUtc": "2026-09-24T15:00:00Z",
          "price": 0.17137
        },
        {
          "start": "2026-09-24T18:00:00+02:00",
          "startUtc": "2026-09-24T16:00:00Z",
          "price": 0.22118
        },
        {
          "start": "2026-09-24T19:00:00+02:00",
          "startUtc": "2026-09-24T17:00:00Z",
          "price": 0.2677
        },
        {
          "start": "2026-09-24T20:00:00+02:00",
          "startUtc": "2026-09-24T18:00:00Z",
          "price": 0.26
        },
        {
          "start": "2026-09-24T21:00:00+02:00",
          "startUtc": "2026-09-24T19:00:00Z",
          "price": 0.225855
        },
        {
          "start": "2026-09-24T22:00:00+02:00",
          "startUtc": "2026-09-24T20:00:00Z",
          "price": 0.204997
        },
        {
          "start": "2026-09-24T23:00:00+02:00",
          "startUtc": "2026-09-24T21:00:00Z",
          "price": 0.188222
        }
      ]
    },
    "gas": null
  },
  "tomorrow": null
}
